[
  {
    "lead_id": "bf1ada91-eecb-4f47-9bfa-1258bb1e0055",
    "type": "individual",
    "first_name": "Erlich",
    "last_name": "Bachman",
    "id": {
      "type": "id",
      "number": "6801015800084",
      "country": "ZA"
    },
    "date_of_birth": "1968-01-01",
    "gender": "male",
    "email": "erlich@aviato.com",
    "cellphone": "+27821234567",
    "phone_other": null,
    "app_data": {
      "company": "Aviato"
    },
    "created_at": "2017-10-12T15:47:34.281Z",
    "created_by": {
      "id": "00000000-0000-0000-0000-000000000001",
      "type": "user"
    },
    "address": {
      "line_1": "5230 Penfield Avenue",
      "suburb": "Woodland Hills",
      "city": "Los Angeles",
      "country": "US",
      "area_code": "CA 91364"
    }
  }
]